[
  {
    "legacy_id": "0",
    "kind": "expansion_price",
    "source_file": "config/main.json",
    "source_layer": "stored",
    "content_version": "004ba829043dfb00d78888a764bd7e13a37db9c5c05195cd910ac3d570678bb3",
    "position": 0,
    "coins": 0,
    "cash": 0,
    "neighbors": 0,
    "inventory_qte": 0
  },
  {
    "legacy_id": "1",
    "kind": "expansion_price",
    "source_file": "config/main.json",
    "source_layer": "stored",
    "content_version": "004ba829043dfb00d78888a764bd7e13a37db9c5c05195cd910ac3d570678bb3",
    "position": 1,
    "coins": 0,
    "cash": 0,
    "neighbors": 0,
    "inventory_qte": 0
  },
  {
    "legacy_id": "2",
    "kind": "expansion_price",
    "source_file": "config/main.json",
    "source_layer": "stored",
    "content_version": "004ba829043dfb00d78888a764bd7e13a37db9c5c05195cd910ac3d570678bb3",
    "position": 2,
    "coins": 0,
    "cash": 0,
    "neighbors": 0,
    "inventory_qte": 0
  },
  {
    "legacy_id": "3",
    "kind": "expansion_price",
    "source_file": "config/main.json",
    "source_layer": "stored",
    "content_version": "004ba829043dfb00d78888a764bd7e13a37db9c5c05195cd910ac3d570678bb3",
    "position": 3,
    "coins": 0,
    "cash": 0,
    "neighbors": 0,
    "inventory_qte": 0
  },
  {
    "legacy_id": "4",
    "kind": "expansion_price",
    "source_file": "config/main.json",
    "source_layer": "stored",
    "content_version": "004ba829043dfb00d78888a764bd7e13a37db9c5c05195cd910ac3d570678bb3",
    "position": 4,
    "coins": 2500,
    "cash": 5,
    "neighbors": 1,
    "inventory_qte": 1
  },
  {
    "legacy_id": "5",
    "kind": "expansion_price",
    "source_file": "config/main.json",
    "source_layer": "stored",
    "content_version": "004ba829043dfb00d78888a764bd7e13a37db9c5c05195cd910ac3d570678bb3",
    "position": 5,
    "coins": 5000,
    "cash": 8,
    "neighbors": 2,
    "inventory_qte": 2
  },
  {
    "legacy_id": "6",
    "kind": "expansion_price",
    "source_file": "config/main.json",
    "source_layer": "stored",
    "content_version": "004ba829043dfb00d78888a764bd7e13a37db9c5c05195cd910ac3d570678bb3",
    "position": 6,
    "coins": 10000,
    "cash": 10,
    "neighbors": 3,
    "inventory_qte": 3
  },
  {
    "legacy_id": "7",
    "kind": "expansion_price",
    "source_file": "config/main.json",
    "source_layer": "stored",
    "content_version": "004ba829043dfb00d78888a764bd7e13a37db9c5c05195cd910ac3d570678bb3",
    "position": 7,
    "coins": 15000,
    "cash": 12,
    "neighbors": 4,
    "inventory_qte": 4
  },
  {
    "legacy_id": "8",
    "kind": "expansion_price",
    "source_file": "config/main.json",
    "source_layer": "stored",
    "content_version": "004ba829043dfb00d78888a764bd7e13a37db9c5c05195cd910ac3d570678bb3",
    "position": 8,
    "coins": 20000,
    "cash": 14,
    "neighbors": 5,
    "inventory_qte": 5
  },
  {
    "legacy_id": "9",
    "kind": "expansion_price",
    "source_file": "config/main.json",
    "source_layer": "stored",
    "content_version": "004ba829043dfb00d78888a764bd7e13a37db9c5c05195cd910ac3d570678bb3",
    "position": 9,
    "coins": 25000,
    "cash": 16,
    "neighbors": 6,
    "inventory_qte": 6
  },
  {
    "legacy_id": "10",
    "kind": "expansion_price",
    "source_file": "config/main.json",
    "source_layer": "stored",
    "content_version": "004ba829043dfb00d78888a764bd7e13a37db9c5c05195cd910ac3d570678bb3",
    "position": 10,
    "coins": 30000,
    "cash": 18,
    "neighbors": 7,
    "inventory_qte": 7
  },
  {
    "legacy_id": "11",
    "kind": "expansion_price",
    "source_file": "config/main.json",
    "source_layer": "stored",
    "content_version": "004ba829043dfb00d78888a764bd7e13a37db9c5c05195cd910ac3d570678bb3",
    "position": 11,
    "coins": 40000,
    "cash": 20,
    "neighbors": 8,
    "inventory_qte": 8
  },
  {
    "legacy_id": "12",
    "kind": "expansion_price",
    "source_file": "config/main.json",
    "source_layer": "stored",
    "content_version": "004ba829043dfb00d78888a764bd7e13a37db9c5c05195cd910ac3d570678bb3",
    "position": 12,
    "coins": 50000,
    "cash": 20,
    "neighbors": 9,
    "inventory_qte": 9
  },
  {
    "legacy_id": "13",
    "kind": "expansion_price",
    "source_file": "config/main.json",
    "source_layer": "stored",
    "content_version": "004ba829043dfb00d78888a764bd7e13a37db9c5c05195cd910ac3d570678bb3",
    "position": 13,
    "coins": 75000,
    "cash": 20,
    "neighbors": 10,
    "inventory_qte": 10
  },
  {
    "legacy_id": "14",
    "kind": "expansion_price",
    "source_file": "config/main.json",
    "source_layer": "stored",
    "content_version": "004ba829043dfb00d78888a764bd7e13a37db9c5c05195cd910ac3d570678bb3",
    "position": 14,
    "coins": 100000,
    "cash": 20,
    "neighbors": 11,
    "inventory_qte": 11
  },
  {
    "legacy_id": "15",
    "kind": "expansion_price",
    "source_file": "config/main.json",
    "source_layer": "stored",
    "content_version": "004ba829043dfb00d78888a764bd7e13a37db9c5c05195cd910ac3d570678bb3",
    "position": 15,
    "coins": 100000,
    "cash": 20,
    "neighbors": 12,
    "inventory_qte": 12
  },
  {
    "legacy_id": "16",
    "kind": "expansion_price",
    "source_file": "config/main.json",
    "source_layer": "stored",
    "content_version": "004ba829043dfb00d78888a764bd7e13a37db9c5c05195cd910ac3d570678bb3",
    "position": 16,
    "coins": 100000,
    "cash": 20,
    "neighbors": 13,
    "inventory_qte": 13
  },
  {
    "legacy_id": "17",
    "kind": "expansion_price",
    "source_file": "config/main.json",
    "source_layer": "stored",
    "content_version": "004ba829043dfb00d78888a764bd7e13a37db9c5c05195cd910ac3d570678bb3",
    "position": 17,
    "coins": 100000,
    "cash": 20,
    "neighbors": 14,
    "inventory_qte": 14
  },
  {
    "legacy_id": "18",
    "kind": "expansion_price",
    "source_file": "config/main.json",
    "source_layer": "stored",
    "content_version": "004ba829043dfb00d78888a764bd7e13a37db9c5c05195cd910ac3d570678bb3",
    "position": 18,
    "coins": 100000,
    "cash": 20,
    "neighbors": 15,
    "inventory_qte": 15
  },
  {
    "legacy_id": "19",
    "kind": "expansion_price",
    "source_file": "config/main.json",
    "source_layer": "stored",
    "content_version": "004ba829043dfb00d78888a764bd7e13a37db9c5c05195cd910ac3d570678bb3",
    "position": 19,
    "coins": 100000,
    "cash": 20,
    "neighbors": 15,
    "inventory_qte": 16
  },
  {
    "legacy_id": "20",
    "kind": "expansion_price",
    "source_file": "config/main.json",
    "source_layer": "stored",
    "content_version": "004ba829043dfb00d78888a764bd7e13a37db9c5c05195cd910ac3d570678bb3",
    "position": 20,
    "coins": 100000,
    "cash": 20,
    "neighbors": 15,
    "inventory_qte": 17
  },
  {
    "legacy_id": "21",
    "kind": "expansion_price",
    "source_file": "config/main.json",
    "source_layer": "stored",
    "content_version": "004ba829043dfb00d78888a764bd7e13a37db9c5c05195cd910ac3d570678bb3",
    "position": 21,
    "coins": 100000,
    "cash": 20,
    "neighbors": 15,
    "inventory_qte": 18
  },
  {
    "legacy_id": "22",
    "kind": "expansion_price",
    "source_file": "config/main.json",
    "source_layer": "stored",
    "content_version": "004ba829043dfb00d78888a764bd7e13a37db9c5c05195cd910ac3d570678bb3",
    "position": 22,
    "coins": 100000,
    "cash": 20,
    "neighbors": 15,
    "inventory_qte": 19
  },
  {
    "legacy_id": "23",
    "kind": "expansion_price",
    "source_file": "config/main.json",
    "source_layer": "stored",
    "content_version": "004ba829043dfb00d78888a764bd7e13a37db9c5c05195cd910ac3d570678bb3",
    "position": 23,
    "coins": 100000,
    "cash": 20,
    "neighbors": 15,
    "inventory_qte": 20
  },
  {
    "legacy_id": "24",
    "kind": "expansion_price",
    "source_file": "config/main.json",
    "source_layer": "stored",
    "content_version": "004ba829043dfb00d78888a764bd7e13a37db9c5c05195cd910ac3d570678bb3",
    "position": 24,
    "coins": 100000,
    "cash": 20,
    "neighbors": 15,
    "inventory_qte": 21
  },
  {
    "legacy_id": "25",
    "kind": "expansion_price",
    "source_file": "config/main.json",
    "source_layer": "stored",
    "content_version": "004ba829043dfb00d78888a764bd7e13a37db9c5c05195cd910ac3d570678bb3",
    "position": 25,
    "coins": 100000,
    "cash": 20,
    "neighbors": 15,
    "inventory_qte": 22
  },
  {
    "legacy_id": "26",
    "kind": "expansion_price",
    "source_file": "config/main.json",
    "source_layer": "stored",
    "content_version": "004ba829043dfb00d78888a764bd7e13a37db9c5c05195cd910ac3d570678bb3",
    "position": 26,
    "coins": 100000,
    "cash": 20,
    "neighbors": 15,
    "inventory_qte": 23
  },
  {
    "legacy_id": "27",
    "kind": "expansion_price",
    "source_file": "config/main.json",
    "source_layer": "stored",
    "content_version": "004ba829043dfb00d78888a764bd7e13a37db9c5c05195cd910ac3d570678bb3",
    "position": 27,
    "coins": 100000,
    "cash": 20,
    "neighbors": 15,
    "inventory_qte": 24
  },
  {
    "legacy_id": "28",
    "kind": "expansion_price",
    "source_file": "config/main.json",
    "source_layer": "stored",
    "content_version": "004ba829043dfb00d78888a764bd7e13a37db9c5c05195cd910ac3d570678bb3",
    "position": 28,
    "coins": 100000,
    "cash": 20,
    "neighbors": 15,
    "inventory_qte": 25
  },
  {
    "legacy_id": "29",
    "kind": "expansion_price",
    "source_file": "config/main.json",
    "source_layer": "stored",
    "content_version": "004ba829043dfb00d78888a764bd7e13a37db9c5c05195cd910ac3d570678bb3",
    "position": 29,
    "coins": 100000,
    "cash": 20,
    "neighbors": 15,
    "inventory_qte": 26
  },
  {
    "legacy_id": "30",
    "kind": "expansion_price",
    "source_file": "config/main.json",
    "source_layer": "stored",
    "content_version": "004ba829043dfb00d78888a764bd7e13a37db9c5c05195cd910ac3d570678bb3",
    "position": 30,
    "coins": 100000,
    "cash": 20,
    "neighbors": 15,
    "inventory_qte": 27
  },
  {